Week,Day,Article_ID,Pillar,Sub_Pillar,Article_Title,URL_Slug,Primary_Keyword,Secondary_Keywords,Search_Intent,User_Awareness_Stage,Difficulty,Monthly_Traffic_Potential,AI_Visibility_Potential,Suggested_Angle,Word_Count,Schema_Markup,EEAT_Opportunity,Internal_Links_From_This_Article,Internal_Links_To_This_Article,Anchor_Text_Suggestions,Suggested_CTA,Monetization_Opportunity,Priority_Score,Notes
4,25,P2-13,P2 - Troubleshooting & Repair,When to Replace Controller,When Should You Replace Your Controller? — Signs It's Time,/when-to-replace-controller,when to replace gaming controller,"controller replacement guide, is my controller broken beyond repair, fix or replace controller",Informational,Problem Aware,Low,8000,High,Signs list: drift / button failure / trigger / cosmetic. Cost to repair vs replace. Links to buying guide.,1600,Article + FAQPage,Based on personal repair experience with multiple controllers,P2-HUB P4-HUB P2-01 P2-03 P1-HUB,"when to replace controller, fix or buy new gamepad","Test your current controller before deciding →",AdSense display (high CPM — buying intent),91,Bridge from P2 troubleshooting to P4 buying guides. Money page.
4,25,P4-08,P4 - Buying Guides & Reviews,8BitDo Controllers Review,8BitDo Controllers — Complete Lineup Review and Comparison 2025,/8bitdo-controllers-review,8bitdo controllers review 2025,"8bitdo review, best 8bitdo controller, 8bitdo ultimate vs pro 2",Commercial Investigation,Solution Aware,Medium,12000,High,Ultimate / Pro 2 / SN30 Pro / Lite 2 / Zero 2. Hall effect models. Retro gaming angle. PC/Switch/Android.,2500,Article + ItemList + FAQPage,Test each model via tester. Document button mappings.,P4-HUB P4-01 P4-06 P3-05 P1-HUB,"8bitdo controller review, best 8bitdo gamepad","Test your 8BitDo controller's inputs →",AdSense display (high CPM),87,Brand-specific review. Loyal 8BitDo community = traffic.
4,25,P3-11,P3 - Compatibility & Platform Support,Controller on Linux,How to Set Up a Gamepad on Linux — Xbox / PS / Generic,/gamepad-linux-setup,gamepad linux setup,"controller linux, xbox controller ubuntu, ps5 controller linux, xpad driver",How-to,Unaware,Medium,10000,High,xpad driver. Xbox on Ubuntu. DS5 on Linux. jstest. Steam on Linux. Proton controller support.,2000,HowTo + FAQPage,Tested on Ubuntu 22.04 LTS,P3-HUB P3-05 P2-10 P10-HUB P1-HUB,"linux gamepad setup, controller linux driver","Test your Linux gamepad configuration →",AdSense display,82,Underserved audience. Linux gaming growing with Steam Deck.
4,26,P3-12,P3 - Compatibility & Platform Support,Controller Emulator Support,How to Use a Controller with PC Emulators — RetroArch / Dolphin,/controller-emulator-support,controller emulator support,"gamepad retro arch, controller dolphin emulator, emulator controller setup",How-to,Aware,Medium,14000,High,RetroArch controller setup. Dolphin NGC controller. mGBA. RPCS3. Controller mapping in each.,2000,HowTo + FAQPage,Test on each emulator with real controller,P3-HUB P3-05 P3-07 P1-HUB P5-03,"controller emulator guide, gamepad retro gaming","Test your emulator controller is working →",AdSense display,84,Retro gaming huge and growing. Underserved by competitors.
4,26,P6-06,P6 - Controller Technology Deep-Dives,Gyro Aiming Explained,Gyro Aiming in Controllers — How It Works and Best Settings,/gyro-aiming-controllers,gyro aiming controllers,"gyroscope controller, gyro aiming ps5, flick stick settings",Informational,Unaware,Low,9000,Very High,How gyro works. Which controllers have it. PS5 / Switch / Steam Deck. Flick Stick technique. PC software.,2000,Article + FAQPage,Test gyro in tester tool (if supported),P6-HUB P3-01 P3-04 P5-HUB P4-07,"gyro aiming guide, controller gyroscope","Test if your controller's gyro is working →",AdSense display,88,Trending topic. Strong AI citation potential. Low competition.
4,26,P1-07,P1 - Gamepad Testing & Diagnostics,D-Pad Test,How to Test Your Controller D-Pad Online — All 8 Directions,/test-controller-dpad-online,test controller d-pad online,"dpad test, d-pad controller check, test directional pad",How-to,Aware,Low,6000,Medium,Explain 8-direction input. Show how tester visualizes each direction. Fighting game SOCD test.,1400,HowTo + FAQPage,Screenshot of all 8 d-pad directions in tester,P1-HUB P1-02 P8-02 P4-05 P2-03,"test d-pad, controller directional pad test","Test your d-pad right now →",AdSense display,79,Supports fighting game and platformer pillar content.
4,27,P1-08,P1 - Gamepad Testing & Diagnostics,Controller Deadzone Test,How to Measure Your Controller's Deadzone — Online Tool Guide,/controller-deadzone-test-online,controller deadzone test,"test controller deadzone, measure gamepad deadzone, deadzone checker",How-to,Aware,Low,8000,High,What deadzone looks like in axis values. Show normal vs excessive deadzone. Link to settings guide.,1600,HowTo + FAQPage,Visualize deadzone circle in tester output,P1-HUB P1-03 P5-01 P5-02 P2-01,"test controller deadzone, measure gamepad deadzone","Check your deadzone → then optimize it with our settings guide",AdSense display,85,Strong use-case for tester tool. Internal link goldmine.
4,27,P1-09,P1 - Gamepad Testing & Diagnostics,Test Controller on Mobile,How to Test a Gamepad on Android or iOS — Browser Tool Guide,/test-gamepad-mobile-browser,test gamepad mobile browser,"controller test android, gamepad test ios, mobile controller tester",How-to,Unaware,Low,7000,High,Which mobile browsers support the Gamepad API. How to access tool on phone. Android Chrome vs iOS Safari.,1500,HowTo + FAQPage,Test on both Android and iOS with screenshots,P1-HUB P7-HUB P3-06 P3-02 P10-01,"test controller on mobile, mobile gamepad tester","Open our tester on mobile →",AdSense display,82,Bridge between P1 and P7. Good for mobile traffic.
4,27,P2-14,P2 - Troubleshooting & Repair,Controller Charging Issues,PS5 Controller Not Charging — 6 Fixes That Work,/ps5-controller-not-charging,ps5 controller not charging,"dualsense not charging, fix ps5 controller battery, controller won't charge",Troubleshooting,Problem Aware,Medium,18000,High,USB-C cable check. USB port power. Rest mode charging. Battery replacement. Reset procedure.,1800,HowTo + FAQPage,Test with multiple cables and ports,P2-HUB P2-HUB P3-01 P1-HUB,"fix ps5 controller charging, dualsense battery fix","Test if controller still responds while charging →",AdSense display,86,High volume. PS5 huge installed base.
4,28,P5-06,P5 - Controller Settings & Configuration,Anti-Recoil Settings,Controller Anti-Recoil Settings for FPS — What Works and What Doesn't,/controller-anti-recoil-settings,controller anti-recoil settings,"anti-recoil controller, reduce recoil gamepad fps, controller recoil compensation",Informational,Solution Aware,Medium,8000,High,In-game settings vs hardware modding. Response curves. What's legitimate vs what violates ToS.,1800,Article + FAQPage,Test different response curve effects in tester,P5-HUB P5-02 P8-01 P4-04,"anti-recoil controller settings, reduce recoil fps gamepad","Test your trigger response profile →",AdSense display,79,Passionate FPS audience. Controversial but high-traffic topic.
4,28,P5-07,P5 - Controller Settings & Configuration,Steam Big Picture Mode Guide,Steam Big Picture Mode Controller Settings — Complete Guide,/steam-big-picture-controller-settings,steam big picture mode controller,"steam tv mode controller, steam living room settings, steam controller big picture",How-to,Aware,Medium,9000,High,Setting up Steam on TV with controller. Big Picture vs Steam Deck UI. Input configuration.,1800,HowTo + FAQPage,Screenshots on actual TV setup,P5-HUB P5-04 P3-05 P7-HUB,"steam big picture settings, steam tv mode","Test your Steam Big Picture controller →",AdSense display,78,Living room gaming growing. Good Steam audience article.
4,28,P4-09,P4 - Buying Guides & Reviews,Best Controllers for Switch,Best Third-Party Nintendo Switch Controllers 2025,/best-switch-controllers-third-party,best third party switch controllers 2025,"best switch controller, third party nintendo controller, switch pro controller alternative",Commercial Investigation,Solution Aware,High,16000,High,8BitDo Pro 2 / PowerA Wireless / Hori Split Pad Pro / GuliKit KK3. Price vs quality analysis.,2500,Article + ItemList + FAQPage,Test each on Switch and PC,P4-HUB P4-01 P4-06 P3-04 P1-HUB,"best switch controller, nintendo gamepad recommendation","Test your Switch controller with our tool →",AdSense display (high CPM),86,Nintendo audience = engaged and buying.
4,29,P3-13,P3 - Compatibility & Platform Support,Controller on Chromebook,How to Use a Controller on Chromebook — Gamepad Support Guide,/controller-chromebook-setup,controller on chromebook,"chromebook gamepad, gamepad chromeos, xbox controller chromebook",How-to,Unaware,Low,8000,High,USB HID on ChromeOS. Bluetooth pairing. Steam on Chromebook (Linux mode). Android game support.,1600,HowTo + FAQPage,Real Chromebook test,P3-HUB P3-05 P3-09 P1-HUB,"controller chromebook, chromeos gamepad","Test your Chromebook controller setup →",AdSense display,80,Low competition. ChromeOS gaming underserved.
4,29,P6-07,P6 - Controller Technology Deep-Dives,USB Polling Rate Explained,USB Polling Rate for Controllers — Does It Matter for Gaming?,/usb-polling-rate-controllers,usb polling rate gaming controller,"125hz vs 1000hz controller, controller polling rate, reduce controller latency usb",Informational,Unaware,Low,6000,High,What polling rate means. 125Hz vs 1000Hz. Actual measured difference. Which controllers allow changes.,1600,Article + FAQPage,Measure actual differences with tester tool,P6-HUB P5-05 P6-02 P2-09 P4-01,"usb polling rate controller, 1000hz gamepad","Measure your controller's actual response rate →",AdSense display,80,Technical audience. Good data angle.
4,29,P2-15,P2 - Troubleshooting & Repair,Controller Repair vs Replace,Should You Repair or Replace a Broken Gaming Controller?,/repair-or-replace-gaming-controller,repair or replace gaming controller,"is controller worth fixing, controller repair cost, broken gamepad repair vs buy",Informational / Commercial,Problem Aware,Low,7000,Medium,Cost analysis. What's fixable vs what's not. When repair makes sense. DIY vs professional.,1600,Article + FAQPage,Provide real cost estimates from personal experience,P2-HUB P2-01 P2-03 P4-HUB P1-HUB,"repair or replace controller, fix broken gamepad","Test exactly what's broken before deciding →",AdSense display (high CPM — buying intent),88,Money article. Bridge from troubleshooting to buying.
4,30,P1-10,P1 - Gamepad Testing & Diagnostics,Xbox Controller Test Guide,How to Test an Xbox Controller Online — Series X/S and Older,/test-xbox-controller-online,test xbox controller online,"xbox controller test, check xbox gamepad, xbox series x controller test",How-to,Navigational,Low,15000,High,Step-by-step for Xbox Series X|S / One / 360 (via USB adapter). What inputs show up. Known Xbox Xinput behavior.,1800,HowTo + FAQPage,Real Xbox controller screenshots in tester,P1-HUB P1-01 P3-02 P3-05 P2-02,"test xbox controller, xbox gamepad checker","Test your Xbox controller right now →",AdSense display,91,Brand-specific. Xbox = largest controller market share on PC.
4,30,P1-11,P1 - Gamepad Testing & Diagnostics,PS5 Controller Test Guide,How to Test a PS5 DualSense Controller Online — Every Input,/test-ps5-dualsense-online,test ps5 dualsense online,"dualsense test, ps5 controller check, test ps5 controller pc",How-to,Navigational,Low,15000,High,What shows up from DualSense in browser: touchpad / motion / haptics / triggers. USB vs BT differences.,1800,HowTo + FAQPage,Real DualSense screenshots across USB and Bluetooth,P1-HUB P1-01 P3-01 P3-05 P2-08,"test ps5 controller, dualsense checker","Test your DualSense right now →",AdSense display,91,Brand-specific. PS5 massive installed base.
