Week,Day,Article_ID,Pillar,Sub_Pillar,Article_Title,URL_Slug,Primary_Keyword,Secondary_Keywords,Search_Intent,User_Awareness_Stage,Difficulty,Monthly_Traffic_Potential,AI_Visibility_Potential,Suggested_Angle,Word_Count,Schema_Markup,EEAT_Opportunity,Internal_Links_From_This_Article,Internal_Links_To_This_Article,Anchor_Text_Suggestions,Suggested_CTA,Monetization_Opportunity,Priority_Score,Notes
2,13,P5-01,P5 - Controller Settings & Configuration,Deadzone Settings,How to Reduce Controller Deadzone — Best Settings for Every Game,/controller-deadzone-settings,controller deadzone settings,"reduce gamepad deadzone, best deadzone settings, adjust controller deadzone",How-to,Solution Aware,Medium,12000,High,What deadzone is. How to test it (link to tester). Software deadzone vs hardware. Steam Input deadzone sliders. Per-game recommendations.,2000,HowTo + FAQPage,Use tester to visualize deadzone before/after adjustment,P5-HUB P1-HUB P1-03 P3-05 P8-01,"set controller deadzone, adjust gamepad deadzone","Measure your current deadzone with our free tester →",AdSense display,91,Strong use of tester as practical tool in the article.
2,14,P5-02,P5 - Controller Settings & Configuration,Sensitivity Settings,Best Controller Sensitivity Settings — PC / PS5 / Xbox,/controller-sensitivity-settings,controller sensitivity settings,"gamepad aim sensitivity, best controller sensitivity fps, analog stick sensitivity",How-to,Solution Aware,Medium,10000,High,Inner/outer deadzone. Response curves. Per-game: CoD / Apex / Fortnite. How to test your settings.,1800,HowTo + FAQPage,Test sensitivity curves in tester to show mathematical response,P5-HUB P5-01 P4-04 P8-01 P3-05,"controller sensitivity guide, best aim settings gamepad","Test how your stick responds to sensitivity changes →",AdSense display,85,Strong connection to P4-04 (FPS controllers).
2,14,P5-03,P5 - Controller Settings & Configuration,Button Remapping Guide,How to Remap Controller Buttons on PC / PS5 / Xbox,/controller-button-remapping,controller button remapping,"remap gamepad buttons, change controller layout, button mapping pc",How-to,Solution Aware,Medium,10000,High,Windows game controllers / Steam Input / Xbox Accessories / PS5 built-in remap. Per-game configs.,1800,HowTo + FAQPage,Screenshots of each remapping interface,P5-HUB P3-05 P4-04 P8-01 P9-01,"remap controller buttons, change gamepad layout","Test your remapped buttons work correctly →",AdSense display,83,Good evergreen how-to.
2,14,P5-04,P5 - Controller Settings & Configuration,Steam Controller Settings,Complete Steam Controller Layout and Settings Guide,/steam-controller-settings-guide,steam controller settings guide,"steam input guide, steam controller layout, steam gamepad configuration",How-to,Aware,Medium,18000,High,All Steam Input options: Joystick / Mouse-like / Camera. Legacy mode. Community layouts. Per-game profiles.,2500,HowTo + FAQPage,Screenshots of every Steam Input option,P5-HUB P3-05 P3-01 P3-02 P3-03 P3-04 P8-HUB,"steam controller guide, steam input settings","Test your Steam controller detection →",AdSense display,90,Very high value. Steam has massive PC gaming audience.
2,15,P5-05,P5 - Controller Settings & Configuration,Input Lag Reduction,How to Reduce Controller Input Lag on PC — Tested Methods,/reduce-controller-input-lag,reduce controller input lag,"controller delay fix, minimize gamepad lag, low latency controller pc",How-to,Solution Aware,Medium,9000,High,Wired vs wireless. USB polling rate. Game mode TV/monitor. Steam Big Picture. Measure with tester.,2000,HowTo + FAQPage,Measure actual input lag improvement via tester tool,P5-HUB P1-04 P2-09 P4-03 P6-02,"reduce controller input lag, minimize gamepad delay","Measure your controller's current input lag →",AdSense display,87,Unique data opportunity: use tester to show lag measurements.
2,15,P6-HUB,P6 - Controller Technology Deep-Dives,HUB PAGE,How Gaming Controllers Work — Technology Explained,/how-gaming-controllers-work,how gaming controllers work,"controller technology explained, gamepad hardware guide, controller internals",Informational,Unaware,Low,8000,Very High,Hub page covering all technology topics. Positions site as technical authority. Earns backlinks.,2000,Article + FAQPage,Original diagrams of controller internals; cite official patents,P6-01 P6-02 P6-03 P6-04 P6-05 P1-HUB P4-HUB,"All P6 articles link here","controller technology guide, how gamepad works","Test what your controller is doing right now →",AdSense display,85,Primary EEAT and backlink-earning pillar.
2,15,P6-01,P6 - Controller Technology Deep-Dives,Haptic Feedback Explained,How Haptic Feedback Works in Gaming Controllers — DualSense Deep Dive,/haptic-feedback-controllers-explained,haptic feedback gaming controllers,"dualsense haptics technology, controller vibration technology, how rumble works",Informational,Unaware,Low,10000,Very High,LRA vs ERM motors. DualSense HD haptics. Adaptive triggers mechanism. Which PC games support it.,2000,Article + FAQPage,Cite Sony patents on DualSense haptic system,P6-HUB P1-05 P3-01 P4-07 P6-02,"haptic feedback technology, dualsense haptics explained","Test your controller's haptic response here →",AdSense display,90,High AI citation. Technical authority builder.
3,16,P6-02,P6 - Controller Technology Deep-Dives,Bluetooth vs Wired Latency,Wired vs Wireless Controller Latency — Tested and Measured,/wired-vs-wireless-controller-latency,wired vs wireless controller latency,"bluetooth controller lag, wired controller faster, wireless controller input delay",Informational / Comparison,Unaware,Medium,15000,Very High,Actual latency measurements. USB 2.4GHz vs Bluetooth vs wired. Data table. Which to choose.,2500,Article + FAQPage,"Original data: measure with your tool. This makes it citable.",P6-HUB P4-03 P2-04 P5-05 P4-01,"wireless vs wired controller latency, bluetooth controller lag","Measure your controller's latency with our tool →",AdSense display,94,Unique data = backlinks + AI citations. Very high value.
3,16,P6-03,P6 - Controller Technology Deep-Dives,Hall Effect Sensors Explained,Hall Effect vs Potentiometer Analog Sticks — Why It Matters,/hall-effect-vs-potentiometer-sticks,hall effect vs potentiometer controller sticks,"magnetic controller sticks, potentiometer drift cause, hall effect sensor gamepad",Informational,Unaware,Low,12000,Very High,Magnetic vs resistive. Why pots wear out → drift. Hall effect lifespan. Which controllers use which.,2000,Article + FAQPage,Cite electronics engineering sources on Hall effect sensors,P6-HUB P4-06 P2-01 P1-03 P6-HUB,"hall effect sticks explained, potentiometer vs magnetic analog","Check if your sticks already have drift →",AdSense display,93,Trending and citable. Bridges technology to buying guide.
3,16,P6-04,P6 - Controller Technology Deep-Dives,USB HID Protocol,How USB HID Works for Gaming Controllers — Technical Guide,/usb-hid-gaming-controllers,usb hid controller,"usb human interface device gamepad, hid controller protocol, usb hid vs xinput",Informational,Unaware,Medium,5000,Very High,HID descriptor. Why controllers enumerate as HID. XInput overlay. Browser Gamepad API relationship.,2000,Article + FAQPage,Cite USB-IF HID specification. Link to MDN Gamepad API docs.,P6-HUB P3-07 P10-01 P10-HUB P1-06,"usb hid gamepad protocol, how controller usb works","Test your USB HID controller in the browser →",AdSense display,82,Developer audience. Earns high-authority backlinks from tech blogs.
3,17,P6-05,P6 - Controller Technology Deep-Dives,Adaptive Triggers Explained,How Adaptive Triggers Work — PS5 DualSense Technology Explained,/adaptive-triggers-explained,adaptive triggers ps5 explained,"dualsense adaptive trigger technology, l2 r2 resistance pc, haptic trigger mechanism",Informational,Unaware,Low,8000,Very High,Actuator mechanism. API calls. Which PC games support full AT. Future of adaptive triggers.,1800,Article + FAQPage,Cite Sony developer documentation,P6-HUB P6-01 P3-01 P4-07 P2-05,"adaptive triggers technology, dualsense trigger resistance","Test if adaptive triggers are working on your DualSense →",AdSense display,88,Very high AI citation potential. Technical + commercial bridge.
3,17,P7-HUB,P7 - Mobile & Handheld Controllers,HUB PAGE,Best Mobile Gaming Controllers — iPhone / Android / Steam Deck,/mobile-gaming-controllers-guide,mobile gaming controllers guide,"best phone gamepad, android controller, iphone gaming controller",Commercial Investigation,Unaware,Medium,25000,High,Hub for mobile gaming controllers. Fastest-growing segment. Link to all P7 articles.,2000,Article + ItemList + FAQPage,Test each controller on real mobile devices,P7-01 P7-02 P7-03 P7-04 P7-05 P3-06 P3-02 P8-HUB,"All P7 articles link here","mobile controller guide, best phone gamepad","Test your mobile controller here →",AdSense display (high CPM),92,High-growth segment. High CPM from mobile gaming audience.
3,17,P7-01,P7 - Mobile & Handheld Controllers,Best iPhone Controllers,Best Controllers for iPhone in 2025 — MFi & Bluetooth Picks,/best-controllers-iphone-2025,best controllers for iphone 2025,"mfi controller iphone, best iphone gamepad 2025, iphone controller bluetooth",Commercial Investigation,Unaware,High,22000,High,Backbone One / Razer Kishi V2 / SteelSeries Nimbus+ / GameSir G8. iOS game support. Apple Arcade.,2500,Article + ItemList + FAQPage,Real test on iPhone with each controller type,P7-HUB P3-06 P8-HUB P4-HUB,"best iphone controller 2025, top mfi gamepad","Check if your iPhone controller works properly →",AdSense display (high CPM),92,High commercial intent. Mobile gaming huge growth market.
3,18,P7-02,P7 - Mobile & Handheld Controllers,Best Android Controllers,Best Controllers for Android in 2025 — Tested Picks,/best-controllers-android-2025,best controllers for android 2025,"android gamepad 2025, best bluetooth controller android, phone controller recommendation",Commercial Investigation,Unaware,High,20000,High,GameSir X2 / Razer Kishi V2 / Xbox BT / PS5 BT. Cloud gaming (Xbox Game Pass / Stadia-era) angle.,2500,Article + ItemList + FAQPage,Real tests on Android device,P7-HUB P3-02 P8-HUB P4-HUB,"best android controller, top gamepad for android phone","Test your Android gamepad compatibility →",AdSense display (high CPM),90,Mirror of iPhone guide. High mobile search volume.
3,18,P7-03,P7 - Mobile & Handheld Controllers,Steam Deck Controller Guide,Best Steam Deck Accessories — Controllers and Peripherals 2025,/steam-deck-controller-accessories,steam deck accessories 2025,"steam deck controller add-on, best steam deck gamepad, steam deck peripheral",Commercial Investigation,Aware,Medium,15000,High,External controllers for Steam Deck docked. Cases with controller holders. Official Steam Deck controller comparison.,2000,Article + ItemList + FAQPage,Real Steam Deck testing,P7-HUB P3-05 P4-01 P8-HUB,"steam deck accessories, steam deck controller","Test your Steam Deck external controller →",AdSense display (high CPM),86,Steam Deck has passionate community. High engagement.
3,18,P7-04,P7 - Mobile & Handheld Controllers,Best Cloud Gaming Controllers,Best Controllers for Cloud Gaming 2025 — Xbox / PS / GeForce Now,/best-controllers-cloud-gaming,best controller for cloud gaming,"xbox game pass controller, cloud gaming gamepad, best controller geforce now",Commercial Investigation,Aware,18000,Very High,Xbox BT / DualSense / GameSir T4 Cyclone. Latency matters most. Comparison with cloud gaming data.,2000,Article + ItemList + FAQPage,Measure input lag during cloud gaming session,P7-HUB P4-03 P6-02 P3-02 P3-06,"cloud gaming controller, best gamepad game pass","Test your cloud gaming controller lag →",AdSense display (high CPM),91,Fast-growing search category. High commercial intent.
3,19,P7-05,P7 - Mobile & Handheld Controllers,MFi Controllers Explained,What Are MFi Controllers? iPhone and iPad Gamepad Guide,/mfi-controllers-explained,mfi controllers iphone,"made for iphone controller, mfi certified gamepad, ios controller standard",Informational,Unaware,Low,7000,High,MFi program explained. Full button mapping in iOS. Which games require MFi vs standard BT.,1600,Article + FAQPage,Cite Apple developer MFi documentation,P7-HUB P7-01 P3-06 P10-HUB,"mfi controller guide, made for iphone gamepad","Test if your MFi controller is recognized →",AdSense display,79,Good informational bridge to buying guides.
3,19,P8-HUB,P8 - Controller Use Cases by Game Genre,HUB PAGE,Best Controller for Every Game Genre — Complete Genre Guide,/controller-for-every-game-genre,best controller for game genre,"controller by game type, best gamepad genre guide, controller recommendation by game",Informational / Commercial,Unaware,Medium,12000,High,Hub linking to per-genre articles. Angle: 'Different games need different controller features.',2000,Article + FAQPage,Tested across genres personally,P8-01 P8-02 P8-03 P8-04 P8-05 P4-HUB P5-HUB,"All P8 articles link here","controller genre guide, best gamepad by game type","Test your controller for your favorite genre →",AdSense display,84,Good internal hub. Supports P4 commercial content.
3,19,P8-01,P8 - Controller Use Cases by Genre,FPS Controllers,Best Controller for FPS Games — Settings and Hardware Guide,/best-controller-fps-games-guide,best controller fps games pc,"fps gamepad guide, controller for shooters settings, first person shooter controller",Commercial + Informational,Solution Aware,High,20000,High,Hardware: hair trigger / short stick travel. Settings: sensitivity / deadzone / response curve. Top picks.,2500,Article + ItemList + HowTo,Test trigger response time via tester,P8-HUB P4-04 P5-02 P5-03 P4-01,"best fps controller, controller for call of duty","Test your FPS controller's trigger precision →",AdSense display (high CPM),90,High commercial + informational combo. Strong AdSense.
3,20,P8-02,P8 - Controller Use Cases by Genre,Fighting Game Controllers,Controller vs Arcade Stick for Fighting Games — Which Should You Use?,/controller-vs-arcade-stick-fighting-games,controller vs arcade stick fighting games,"pad vs fightstick, best controller street fighter, fighting game input device",Comparison,Solution Aware,Medium,12000,High,D-pad quality matters. Pad players in pro scene. SOCD on hitbox. Top pads vs sticks.,2500,Article + FAQPage,D-pad precision test via tester,P8-HUB P4-05 P5-03 P1-02,"controller vs arcade stick, best pad fighting games","Test your d-pad precision with our tool →",AdSense display (high CPM),83,Passionate niche. Good commercial angle.
3,20,P8-03,P8 - Controller Use Cases by Genre,Racing Sim Controllers,Best Controller for Racing Games — Wheel vs Gamepad Guide,/best-controller-racing-games,best controller for racing games,"racing sim gamepad, controller vs wheel racing, best gamepad forza",Comparison,Solution Aware,Medium,10000,High,Analog trigger precision for throttle. Hall effect triggers. Wheel vs controller for sim vs arcade racing.,2000,Article + FAQPage,Trigger precision measurement via tester,P8-HUB P4-01 P5-03 P6-01,"racing game controller, best gamepad racing sim","Test your racing controller's analog precision →",AdSense display (high CPM),81,Niche but high-intent. Racing sim community is engaged.
3,20,P8-04,P8 - Controller Use Cases by Genre,Platformer Controllers,Best Controller for Platformer Games — D-Pad or Analog?,/best-controller-platformer-games,best controller platformer games,"controller for platformers, d-pad vs analog stick platformer, 2d game controller",Informational / Commercial,Solution Aware,Low,8000,Medium,D-pad for precision 2D. Analog for 3D. SNES-style vs modern. 8BitDo SN30 Pro recommendation.,1800,Article + FAQPage + ItemList,D-pad test via tester,P8-HUB P4-05 P4-02 P1-02,"platformer controller, best d-pad gamepad","Test your d-pad accuracy here →",AdSense display,77,Lower volume but easy content. Good for 8BitDo audience.
3,21,P8-05,P8 - Controller Use Cases by Genre,RPG and JRPG Controllers,Best Controller for RPG / JRPG Games — Comfort and Features,/best-controller-rpg-games,best controller rpg games,"controller for jrpg, rpg gamepad guide, best gamepad final fantasy dragon quest",Informational / Commercial,Solution Aware,Low,7000,Medium,Comfort for long sessions. Face button quality. DualSense haptics in supported JRPGs.,1600,Article + ItemList,Personal long-session test,P8-HUB P4-01 P4-07 P4-02,"best rpg controller, jrpg gamepad recommendation","Test your RPG controller before your next session →",AdSense display,73,Niche but loyal audience. JRPG community is passionate.
3,21,P9-HUB,P9 - Accessibility & Adaptive Controllers,HUB PAGE,Accessible Gaming Controllers — Complete Guide for Every Need,/accessible-gaming-controllers-guide,accessible gaming controllers,"adaptive controller guide, disability gaming, one-handed gaming controller",Informational,Unaware,Low,5000,Very High,Hub for accessibility gaming. Xbox Adaptive Controller. One-handed gaming. Switch accessibility.,2000,Article + FAQPage,Research official Microsoft accessibility documentation,P9-01 P9-02 P9-03 P1-HUB P4-HUB,"All P9 articles link here","accessible gaming guide, adaptive controller options","Test any adaptive controller setup here →",AdSense display,83,Low competition. Strong EEAT signal. Potential for press coverage.
3,21,P9-01,P9 - Accessibility & Adaptive Controllers,Xbox Adaptive Controller,Xbox Adaptive Controller — Complete Setup and Use Guide,/xbox-adaptive-controller-guide,xbox adaptive controller,"xac guide, adaptive controller setup, accessible gaming xbox",Informational,Unaware,Low,8000,Very High,What it is. Compatible accessories. Software setup. Gaming with limited mobility. Real-world use cases.,3000,Article + HowTo + FAQPage,Cite Microsoft accessibility documentation and disability gaming communities,P9-HUB P9-02 P3-HUB P1-HUB,"xbox adaptive controller guide, xac setup","Test your adaptive controller setup →",AdSense display,88,Low competition + strong EEAT. Potential for links from disability/accessibility sites.
3,22,P9-02,P9 - Accessibility & Adaptive Controllers,One-Handed Gaming,One-Handed Gaming — Best Controllers and Setups,/one-handed-gaming-controllers,one-handed gaming controller,"single hand gaming, disability gaming controller, one handed gamepad setup",Informational,Unaware,Low,6000,High,Adapted controllers. Keyboard+controller hybrid. Switch accessibility mode. Community resources.,2500,Article + FAQPage,Cite disability gaming community (AbleGamers),P9-HUB P9-01 P3-HUB P4-HUB,"one-handed gaming setup, single hand controller","Test one-handed controller inputs here →",AdSense display,82,Strong EEAT + low competition.
3,22,P9-03,P9 - Accessibility & Adaptive Controllers,Switch Accessibility Features,Nintendo Switch Accessibility Features — Controller Options Guide,/nintendo-switch-accessibility-features,nintendo switch accessibility features,"switch accessibility mode, nintendo disability gaming, switch controller options",Informational,Unaware,Low,5000,High,Switch accessibility settings. Compatible adaptive controllers. Joy-Con grip options.,1800,Article + FAQPage,Cite Nintendo official accessibility documentation,P9-HUB P9-01 P3-04 P1-HUB,"switch accessibility, nintendo adaptive gaming","Test your Switch controller configuration →",AdSense display,74,Low competition. EEAT opportunity.
3,22,P10-HUB,P10 - Developer & Technical Integration,HUB PAGE,Web Gamepad API — Developer Guide and Reference,/web-gamepad-api-guide,web gamepad api guide,"javascript gamepad, browser gamepad api, gamepad api developer",Informational,Unaware,Low,6000,Very High,Hub for developer content. Gamepad API reference. Controller in games. Technical integration.,2000,Article + FAQPage,Cite W3C Gamepad API specification,P10-01 P10-02 P10-03 P1-HUB P6-04,"All P10 articles link here","gamepad api guide, web controller developer","See the Gamepad API in action — test your controller →",AdSense display,85,Link magnet from developer community. High-authority backlinks.
3,22,P10-01,P10 - Developer & Technical Integration,Web Gamepad API Tutorial,The Complete Web Gamepad API Tutorial — JavaScript Controller Support,/web-gamepad-api-tutorial,web gamepad api tutorial,"javascript gamepad api, browser controller api, navigator.getgamepads",Informational,Unaware,Low,8000,Very High,navigator.getGamepads(). Button polling. Axis values. Deadzone math. Cross-browser support table.,3000,Article + FAQPage,Link to W3C spec. Include working CodePen demo.,P10-HUB P6-04 P3-09 P1-HUB P3-07,"web gamepad api tutorial, javascript controller code","Test the Gamepad API live with our tool →",AdSense display,90,Will earn links from GitHub / Stack Overflow / MDN community.
3,23,P10-02,P10 - Developer & Technical Integration,Add Controller Support to Browser Game,How to Add Gamepad Support to a Browser Game — Step by Step,/add-gamepad-support-browser-game,add gamepad support browser game,"controller support html5 game, gamepad api game dev, javascript controller game",How-to,Unaware,Low,5000,Very High,Full code tutorial. Input loop. Button mapping. Deadzone implementation. Test with gamepadtester.live.,2500,HowTo + Article,Link to working demo hosted on site,P10-HUB P10-01 P6-04 P1-HUB,"add controller support game, gamepad api game dev","Test your implementation with our live tool →",AdSense display,86,Developer audience + link magnet. High citation potential.
3,23,P10-03,P10 - Developer & Technical Integration,Gamepad API Browser Compatibility,Web Gamepad API Browser Compatibility — 2025 Support Table,/gamepad-api-browser-compatibility-2025,gamepad api browser compatibility,"gamepad api chrome firefox edge, browser controller support 2025, web api gamepad support",Informational,Unaware,Low,5000,Very High,Chrome / Firefox / Edge / Safari support levels. Known bugs per browser. Polyfill options.,1600,Article + FAQPage,"Personally test each browser. Unique data = citations.",P10-HUB P10-01 P3-09 P1-HUB P6-04,"gamepad api browser support, controller api compatibility","Test your browser's gamepad support now →",AdSense display,84,Very high AI citation target. Browsers frequently queried by devs.
3,23,P2-08,P2 - Troubleshooting & Repair,DualSense on PC Issues,PS5 DualSense Not Working on PC — Complete Fix Guide,/dualsense-not-working-pc,dualsense not working on pc,"ps5 controller pc problems, dualsense pc issues, dualsense driver windows",Troubleshooting,Problem Aware,Medium,18000,High,Driver issues. DS4Windows conflict. Steam vs non-Steam. Haptics/AT not working on PC.,2000,HowTo + FAQPage,Test on actual Windows 11 PC,P2-HUB P3-01 P3-05 P1-HUB P2-02,"fix dualsense pc, ps5 controller windows issues","Test if your DualSense is fully working →",AdSense display,89,Supports the PS5-on-PC pillar. Very high search volume.
3,23,P2-09,P2 - Troubleshooting & Repair,Input Lag Fix,How to Fix Controller Input Lag on PC — Measured Solutions,/fix-controller-input-lag-pc,fix controller input lag,"reduce gamepad lag, controller delay windows, fix input latency pc",Troubleshooting,Problem Aware,Medium,12000,High,USB polling rate. Bluetooth vs USB. Windows power plan. Game settings. Measure before/after.,2000,HowTo + FAQPage,Measure actual lag reduction with tester tool data,P2-HUB P5-05 P6-02 P4-03 P1-HUB,"fix controller input lag, reduce gamepad delay","Test your controller's current input lag →",AdSense display,88,Strong data angle using tester.
4,24,P2-10,P2 - Troubleshooting & Repair,Controller Driver Fix Windows,How to Fix Gamepad Driver Issues on Windows 10 and 11,/fix-gamepad-driver-windows,gamepad driver issues windows,"controller driver not installing, gamepad not recognized windows, fix controller driver",Troubleshooting,Problem Aware,Medium,20000,Very High,Device Manager steps. Driver reinstall. Generic HID vs manufacturer driver. xinput fix.,2000,HowTo + FAQPage,Screenshots of Windows 11 device manager steps,P2-HUB P2-02 P3-07 P1-06 P1-HUB,"fix gamepad driver windows, controller driver reinstall","After fixing driver — test your controller here →",AdSense display,93,Very high volume. Windows driver issues = massive search demand.
4,24,P2-11,P2 - Troubleshooting & Repair,Joy-Con Drift Fix,How to Fix Joy-Con Drift — Nintendo's Known Issue Explained,/fix-joy-con-drift,fix joy-con drift,"joy-con stick drift, nintendo joy-con drifting, switch controller drift fix",Troubleshooting,Problem Aware,High,45000,Very High,Nintendo's known issue. Compressed air fix. Stick recalibration. Replacement options. Nintendo repair program.,2500,HowTo + FAQPage,Test Joy-Con axes in browser tester before/after fix,P2-HUB P2-01 P1-03 P3-04 P4-06,"fix joy-con drift, nintendo controller drift","Test if your Joy-Con still has drift after fixing →",AdSense display,97,Massive search volume. One of the highest-searched controller issues.
4,24,P2-12,P2 - Troubleshooting & Repair,PS5 DualSense Drift Fix,How to Fix PS5 DualSense Stick Drift — 5 Methods,/fix-ps5-dualsense-drift,fix ps5 dualsense drift,"dualsense stick drift fix, ps5 controller drifting, fix ps5 analog stick",Troubleshooting,Problem Aware,High,40000,Very High,Diagnose with tester. Compressed air. Isopropyl. Deadzone workaround. Sony repair. Hall effect replacement.,2500,HowTo + FAQPage,Show tester readout before and after each fix method,P2-HUB P2-01 P1-03 P3-01 P4-06,"fix dualsense drift, repair ps5 controller stick","Test if your DualSense drift is fixed →",AdSense display,97,Massive volume. PS5 installed base = huge audience.
